{
  "schemaVersion": "1.0",
  "valid": true,
  "source": {
    "language": "python",
    "path": "examples/python/dex_examples/patterns/parallel/dynamic_parallel_steps_flow.py"
  },
  "flow": {
    "name": "DynamicParallelStepsFlow",
    "startStepId": "step:InitStep",
    "span": {
      "startLine": 47,
      "startColumn": 1,
      "endLine": 56,
      "endColumn": 38
    }
  },
  "nodes": [
    {
      "id": "decision:step:DoWork:37:16",
      "kind": "decision",
      "name": "gracefulComplete",
      "parentId": "step:DoWork",
      "phase": "execute",
      "span": {
        "startLine": 37,
        "startColumn": 16,
        "endLine": 37,
        "endColumn": 40
      },
      "decision": {
        "type": "gracefulComplete"
      }
    },
    {
      "id": "decision:step:InitStep:42:16",
      "kind": "decision",
      "name": "goToMany",
      "parentId": "step:InitStep",
      "phase": "execute",
      "span": {
        "startLine": 42,
        "startColumn": 16,
        "endLine": 44,
        "endColumn": 10
      },
      "decision": {
        "type": "goToMany"
      }
    },
    {
      "id": "step:DoWork",
      "kind": "step",
      "name": "DoWork",
      "phase": "execute",
      "span": {
        "startLine": 53,
        "startColumn": 59,
        "endLine": 53,
        "endColumn": 68
      }
    },
    {
      "id": "step:InitStep",
      "kind": "step",
      "name": "InitStep",
      "phase": "execute",
      "start": true,
      "span": {
        "startLine": 53,
        "startColumn": 36,
        "endLine": 53,
        "endColumn": 45
      }
    }
  ],
  "edges": [
    {
      "id": "edge:0001",
      "kind": "transition",
      "from": "decision:step:InitStep:42:16",
      "to": "step:DoWork",
      "label": "fan-out",
      "multiplicity": "×N",
      "span": {
        "startLine": 43,
        "startColumn": 15,
        "endLine": 43,
        "endColumn": 45
      }
    }
  ],
  "diagnostics": []
}
