{
  "schemaVersion": "1.0",
  "valid": true,
  "source": {
    "language": "python",
    "path": "examples/python/dex_examples/patterns/reminders/reminder_flow.py"
  },
  "flow": {
    "name": "ReminderFlow",
    "startStepId": "step:ReminderStep",
    "span": {
      "startLine": 61,
      "startColumn": 1,
      "endLine": 77,
      "endColumn": 44
    }
  },
  "nodes": [
    {
      "id": "decision-dispatch:step:ReminderStep",
      "kind": "decision_dispatch",
      "name": "Decision",
      "parentId": "step:ReminderStep",
      "phase": "execute",
      "span": {
        "startLine": 54,
        "startColumn": 5,
        "endLine": 58,
        "endColumn": 41
      }
    },
    {
      "id": "decision:step:ReminderStep:56:20",
      "kind": "decision",
      "name": "gracefulComplete",
      "parentId": "step:ReminderStep",
      "condition": "not context.has_timer_fired()",
      "phase": "execute",
      "span": {
        "startLine": 56,
        "startColumn": 20,
        "endLine": 56,
        "endColumn": 39
      },
      "decision": {
        "type": "gracefulComplete"
      }
    },
    {
      "id": "decision:step:ReminderStep:58:16",
      "kind": "decision",
      "name": "goTo",
      "parentId": "step:ReminderStep",
      "condition": "not (not context.has_timer_fired())",
      "phase": "execute",
      "span": {
        "startLine": 58,
        "startColumn": 16,
        "endLine": 58,
        "endColumn": 41
      },
      "decision": {
        "type": "goTo"
      }
    },
    {
      "id": "resource:channel:ReminderFlow.opt_out",
      "kind": "channel",
      "name": "OptOut",
      "span": {
        "startLine": 64,
        "startColumn": 5,
        "endLine": 64,
        "endColumn": 51
      },
      "resource": {
        "valueType": "None"
      }
    },
    {
      "id": "rpc:opt_out_reminders",
      "kind": "rpc",
      "name": "opt_out_reminders",
      "span": {
        "startLine": 76,
        "startColumn": 5,
        "endLine": 77,
        "endColumn": 44
      }
    },
    {
      "id": "step:ReminderStep",
      "kind": "step",
      "name": "ReminderStep",
      "phase": "wait_for+execute",
      "start": true,
      "span": {
        "startLine": 70,
        "startColumn": 36,
        "endLine": 70,
        "endColumn": 54
      }
    },
    {
      "id": "wait:ReminderStep:49:16:0",
      "kind": "wait",
      "name": "anyOf",
      "parentId": "step:ReminderStep",
      "phase": "wait_for",
      "span": {
        "startLine": 49,
        "startColumn": 16,
        "endLine": 52,
        "endColumn": 10
      },
      "wait": {
        "type": "anyOf",
        "conditions": [
          {
            "kind": "timer",
            "label": "REMINDER_INTERVAL timer",
            "expression": "REMINDER_INTERVAL",
            "span": {
              "startLine": 50,
              "startColumn": 13,
              "endLine": 50,
              "endColumn": 49
            }
          },
          {
            "kind": "channel",
            "label": "OptOut.for 1",
            "resourceId": "resource:channel:ReminderFlow.opt_out",
            "span": {
              "startLine": 51,
              "startColumn": 13,
              "endLine": 51,
              "endColumn": 35
            }
          }
        ]
      }
    }
  ],
  "edges": [
    {
      "id": "edge:0001",
      "kind": "transition",
      "from": "decision:step:ReminderStep:58:16",
      "to": "step:ReminderStep",
      "label": "go_to",
      "span": {
        "startLine": 58,
        "startColumn": 16,
        "endLine": 58,
        "endColumn": 41
      }
    },
    {
      "id": "edge:0002",
      "kind": "wait_condition",
      "from": "resource:channel:ReminderFlow.opt_out",
      "to": "wait:ReminderStep:49:16:0",
      "label": "OptOut.for 1",
      "span": {
        "startLine": 51,
        "startColumn": 13,
        "endLine": 51,
        "endColumn": 35
      }
    },
    {
      "id": "edge:0003",
      "kind": "resource_publish",
      "from": "rpc:opt_out_reminders",
      "to": "resource:channel:ReminderFlow.opt_out",
      "label": "publish",
      "span": {
        "startLine": 77,
        "startColumn": 9,
        "endLine": 77,
        "endColumn": 44
      },
      "metadata": {
        "phase": "rpc"
      }
    }
  ],
  "diagnostics": []
}
